Position Name,Job,Salary,Job Type,Shift & Schedule,Company,Location,Rating,URL,Id,Posted At,Scraped At,Short Description,External Apply Link
"Financial Analyst - Bridgeview, IL",Financial Analyst ,,,,Rose Paving,"Bridgeview, IL 60455",3.0,https://www.indeed.com/pagead/clk?mo=r&ad=-6NYlbfkN0AEaP87KEAR_HNt1evrRbD0v1SZdik1iEh0jcIKOB8gVX-PoH8pkaCi8uMRKBYNqRH_Sd3KQehI8MM63VKqveikBmXxIUN8HuITXlTx3sHBrIvdsrv7WHdsED8aJL5nfkvTtnSj1hE_o4qm_a2gnnkU7FbRrzIilkAPOUh6WccuF0iqN9ZT14hlZw4g8UPXOEZ5WfXQeBW7md-J5GsKP44IOQ7h9CIxJkIJol1fx58ScFhQIwWH6r-4g8lpImmGweA8QI-jLhyO412wH8XZsY6Gfb2xPaUQdQWj8vxEW9VYajxxwF03rMO5rh6s0HHDqfixpUlfdSkeF7aj6DshimsGn64YSfzBNmzWgToJir0_oKXWAI6579d0wkwr0H8fRS00qggyNDWU91Wo3p5hRLi03zelxH7fPqBjb3UoJ4baF4AIRZxB5oHwZ27HbUytvHM19oOkNJP33a5E9sUicX1_foUZv19SrztteyD3UzVIIU6xPPKcENsiu4oz1Yz7rPPpP2Omn1-0ubuM4qjTbG7LqItaGpvIIKY9tBOqwZ-tTSkH4XBdA7t1dh-TVb_i_2E_rPhZzf44myvRXAOwfIiraibURyNjMoohhIA7turKGclUIzlQmFJdQzhHTGFSVYg=&xkcb=SoBN-_M3QXvhnsADTz0KbzkdCdPP&p=0&fvj=0&vjs=3,ac06a90bfedc0044,EmployerActive 4 days ago,2023-04-23T17:51:14.899Z," 
 Experience with data analysis and financial modeling.
 The Financial Analyst will report directly to the Director of Financial Planning & Analysis and will be…
",www.indeed.com/applystart?jk=ac06a90bfedc0044
Senior Financial Reporting Analyst,Financial Analyst ,"$78,900 - $108,500 a year",Full-time,Additional job details401(k) matchingPaid time off401(k)Health insuranceDisability insurance+ 2 more,Stanford Federal Credit Union,"Hybrid remote in Palo Alto, CA 94303",2.8,https://www.indeed.com/pagead/clk?mo=r&ad=-6NYlbfkN0CY4IeDPuTXaLbALXGnSxH6zMeyqm6DDaNVv9XF_RDm5Flp6f60jV5bAGbjLX9Y2_OoYHkFywyoC4w5eGFpq8Kf1u1omswXPjZO8_HZCpROwoRhJG4XUXzRL3R1_88jH2QEcIe2RGdKjPCDfYLQi3zs9t2tkoGo6Rgj-vyWkUqV40gHn9ywVkC_J0H15wAr3qXVmlg6O80XCIzp1vZ955PlRmtEor0E0OMBDEdhS3kzMRddy3YNqMUR8c5lo-AtnCiBpM9geOZuVzEKBGmMeBLerHf-h4heALlyWgOm1v5aL_oUKGicO3-dAmr56MS6Y5gvd1LY-lo28oEY4XyZ3OOeCDiGXrdYu0DM-YeqSHIphcou55ghfgDOjOt5u8pjiOybFbd38izrtu6e1wJsG3-lVF80zSTFNzh5KJ4Fh6SjeZqPFuDlfNtrRmPJa3vQSHZc9x1G8HIgOeIMpuCKsJ0jqwQLACFzr0UwP4mtZX-pkewbzJ607VKDWA7dn0iadHHYTJdsfELDhoQ0sasn13Hcop3EPuW1rbmxZ2P05Bo_GGXS7OT2oCbc_LY_ZbHdF9QsfBCPfvKZmDHkQREwQE7rhLogCvP8uo2OtcgIc0Sp8je1imCet1HoyNV8z9PRu3Z4NQnBGaTehk0-IhDkJkci9FeAWZPwzZjzsB0T-3gevA6lZKh9VCZrQk0HoEsK6osCVoop6HCr4ksG88GlQ5eLR6GeStySjyJkExK1rH8_dtoHPaDazeIeK0RSXwhyAl1lY7OlHHQhMKFYHGw7CycdHstbdy12M3o=&xkcb=SoDQ-_M3QXvhnsADTz0JbzkdCdPP&p=1&fvj=0&vjs=3,3fd422d9ed09968f,PostedPosted 30+ days ago,2023-04-23T17:51:14.900Z," 
 Five or more years related experience in a business intelligence, financial reporting, financial analyst, accounting analyst, public accounting, financial…
",www.indeed.com/applystart?jk=3fd422d9ed09968f
Senior Financial Analyst,Financial Analyst ,"From $70,000 a year",Full-time,8 hour shift,Linde/Praxair Surface Technologies,"Indianapolis, IN 46224+1 location",,https://www.indeed.com/pagead/clk?mo=r&ad=-6NYlbfkN0BVAiU9YL_kSZxFdjxsmhuHZSnIs3yy0HtrvQ_k7qM2fBrBvjzCZ8ys1xGXPoH4ARCAwfQKS5QyWUFogTnPYPdxyYWJbVX2-UXpUIULHhjyu4Ji9WBUpnQcuUAE1Xg7unlLshYRQ8N1JE8BuTQ0tbhjuXSK__haE1eTpyW_hKf7eHAnY3VGmdAr64KXRQ29Nx-6l9LDKAzhGP24jiqHgfuSrXJQrGgQ3EkayGBrS4oT9a9ayuhNPzXGH64VBvzwJqnxeWm5_71pXM4TgKT_Rdf899xQ5uWDQwd1BcmOGyK6wmCHKAty6w-jChkZxf6-MXVq2E6GcLIjOTQH0YHipX34pFJYMAVY2jTuYWNmWb__D509HTmmjtdH835JEbS8e55e8sDCVwOpQOI82-VWtC1CtycermY4we4V_Oii-Vj6olwUDUu3OdBYR8YLv-RjjDuJgr0q-46c3wBnz2NB-taHjix7EcI-v7mBS_5ElCVCXeVy4O9jH4ec7RcOCj0fSdMsDjP7CceXIhXwoHURpYSRA2c9vAlR9fkvR-BgsozzrA==&xkcb=SoBk-_M3QXvhnsADTz0IbzkdCdPP&p=2&fvj=1&vjs=3,fc6a028979fc53fc,EmployerActive 4 days ago,2023-04-23T17:51:14.900Z," 
 Prepare site’s financial slides and report financial results during Monthly Business Review (MBR) presentation with global leadership.
",www.indeed.com/applystart?jk=fc6a028979fc53fc
"Financial Analyst - Redding, CA",Financial Analyst ,$23 - $35 an hour,Full-time,Monday to Friday +1,"Maas Energy Works, Inc","Redding, CA 96001",,https://www.indeed.com/pagead/clk?mo=r&ad=-6NYlbfkN0CKammWz-QfI4wcKX8XbN9eazqG8_SLcH7e_5jSCB8NBDsdZdI2D4ul4MnJmHElzmonocYFz2_AIH19duqnGkd6MteTCmlZGmXRS_Bln8ieUQcwt9TS1Z8aTzGIvnXTc5T8XxNhmDXQfNCWkhLVCJTNGyAZ31w981eLJf03WZKqZlEkdWkL5-SZQEJeL1D_eKl6mUX_4M2_09cAQt9SXfWPXq3xscRrF3XkDTu1Hhr8DnaMAnwJZJ6SW5D6mB124_fp-0AMNfB3DdHeyv4cxWaRdpGS2_q58-YEjGjKkLnn3-iF2tq0dNElzW-l-AUIuSXG9ML8gch6Y3FRPMw7bUedo8WTYw6Nvz8Q10AN3thJedPV3enHeXaoYJLOkbjbm9k70AwKeBNmYEIlacfd3Pe2ruqI4tfnqFdptUx_KPf3DlkAVW1HLNzOCqgIigRZ_P-_pZT8AsY4VRUmrACnMj8hd0FyMocSqEZg8a8VsmBc-aqYfEzgBTGU-I1klWJL4G2y57B0rZ_JkF1cBojaS9ERHTP82Vj2U6VaiU5MZ-1IGKOTC6mVGEH0&xkcb=SoDq-_M3QXvhnsADTz0PbzkdCdPP&p=3&fvj=1&vjs=3,90ce5bf7c7c23198,EmployerActive 2 days ago,2023-04-23T17:51:14.901Z," 
 Manage system to calculate the carbon intensity score of all operating projects in real time to ensure compliance with the project’s certified CI score.
",www.indeed.com/applystart?jk=90ce5bf7c7c23198
Sr. Financial Analyst,Financial Analyst ,$34 an hour,Full-time,Additional job detailsCPA,Charleston International Airport,"North Charleston, SC 29418",3.8,https://www.indeed.com/pagead/clk?mo=r&ad=-6NYlbfkN0CchKwpGoHeQH9NGj4pph2POlqhnZ0MHVtdFtuOARABk4j1JLjzTb0kX6_5WL_UjkT0vMymVA4dGihua4LsHIPWCSr7pAEKR1B7OZXhCuRHA45kt7JRHmVl3Wa0lNcHdRcODeD9yfLzPxqLc-Znd_PxUQQXUIWEPgNwCQTOSBcnesNwo6rCX39VPBs0fPRTNLgmYqLKd2O96oyR6vz2XfToj6QCSv9Wz-Z2IN56II3__ymhn9X0GPS5qCJoS1PPgJ1Oq6h5VQpojl8--G1c-iQUQwHHjBy4zoIdZiio3ISPU3xe34ueiroxzkQzcO3Hu_Y5UtZ3v7ataVWa8YfTekVp79p8zeC_mOhygWUeAP1MlX7qtWyrF8xN-1SHnXdrNE1PWExVwQaU9WlEBlFxATmy1QWue0uKBWwFyNY9EyJX1ZMN_BcnU4-yDW1XjZtIkX9dS2yHMK_NHQ-sbUbhEuopCQXKzgK_FdOjh5KifGZPtblICn8630ABy_B-8o_onkI4B_j2jyadMj8xLFlpanvQ8kCNZbefoQE=&xkcb=SoBe-_M3QXvhnsADTz0ObzkdCdPP&p=4&fvj=0&vjs=3,2010bd25c893f04f,PostedPosted 17 days ago,2023-04-23T17:51:14.901Z," 
 Assist with the financial planning and budgeting process, analyze financial statements and reports, develop financial models, prepare projections, and perform…
",www.indeed.com/applystart?jk=2010bd25c893f04f
Financial Analyst III - FAS - Remote,Financial Analyst ,"$74,817 - $127,316 a year",Full-time,Monday to Friday +5,Mayo Clinic,+1 locationRemote,3.9,https://www.indeed.com/pagead/clk?mo=r&ad=-6NYlbfkN0B9OQ_OP4TO7X1ByUtpX8JBZIY3KEUg3iNZkW7OYhr-UhCxUEdnNqDR-AaYrIllLklWE2U01SaYLBRE4ppYzXasrhukMdtWH5m6uTrQmMW6CcL1wkqu3FE3qQrVK-F5gdv92_os7ChyfKN_Bng67uwn3v105CAl4BJgBYnPKtL0C18tvGBg3TA9xp8ufQbLEsXNzRsmbZHw2-w-N-tboEb-bXK9aMbTlgG2mMqoYpRWawAhnSN_V4hwwIlWICr6sO6L8m1Qkpeu2mmqqakQnj4n-WHJYR0bgKYfcM770wgJAQoqUgdPtLBb6nge2qqCjN99ShG31mr7pNaHpcQf2Rjpg1kAtcXi2whXMvLsAiWiphMdVprkeqjfHgez4DCdY726mF_Pl99kj50ucJcxALGHblsaY2DNCqdn7XwiHW-0-I8_oUnqNwdTZFNw-RUk7QPjekTi8FFuJ7jGDzhFbG0ty7BMgwnzIpSpsYEnP2Vi1uCVZOgjx8tkd2S_4iayNl-O19RuPkTOCfUyEohxhSkRrOHhTYSCY0YaWezNDGkzn9MGCnnD_HcMSAQfHkI7CiYSHVW0cNPGI-pz00PWgUnuU8FGMf_bH2e212b9gaCn5sLW_aZ742ERFhM9Wa0ch26fnBMurEx8pTzk8rSc5Btza6X6mvAfYHW2wLVt1nK01DHGncqF3BuD&xkcb=SoDD-_M3QXvhnsADTz0NbzkdCdPP&p=5&fvj=1&vjs=3,5a0fabd01047c692,EmployerActive 5 days ago,2023-04-23T17:51:14.901Z,"If degree is in Accounting or Finance, minimum of 6 years applicable experience in accounting or finance is required.
 Mentors, coaches, and trains staff.",www.indeed.com/applystart?jk=5a0fabd01047c692
Budget Analyst,Financial Analyst ,"$56,628 - $107,010 a year",,,TSA (Transportation Security Administration),United States,3.1,https://www.indeed.com/rc/clk?jk=7701375cb4f79027&fccid=3e0864a4b602baa7&vjs=3,7701375cb4f79027,PostedPosted 3 days ago,2023-04-23T17:51:14.902Z,"04/19/2023 to 05/03/2023.
 Securing Travel, Protecting People - At the Transportation Security Administration, you will serve in a high-stakes environment to…",www.indeed.com/applystart?jk=7701375cb4f79027
Budget Analyst,Financial Analyst ,"$53,105 - $122,459 a year",Monday to Friday +1,,National Security Agency,"Fort Meade, MD",4.1,https://www.indeed.com/pagead/clk?mo=r&ad=-6NYlbfkN0AC5S5KfpcrE62cRuYLg6qW_HWiPjKHP06qk-AGfbwYtGlr3wcSMURH9oqKq1q2FCdXwANnWl6TpG-TYLB53WdNaVWv7Z075Y4aEbmFDEzTneQTUfP5Wx3-zQcJKssIubzXyzQS5M_O12mhpbM-QNlBCiUQZ8f9ww8TOk0uPE1u1Q2FWn64GkETokg-oQ4N10h6-4rsj1kwztklMz2KfSbbRHEBG2vL29djfCwihPw0qWvjhTPgMB6G2I9eMokrQDk1OBzxmFyjKO6SVuN7Bsm-GypvWnjHR4yVTP9BJK0xhBq5iVDC_4dh6TNPmGu0buEvUSyVNrxrCzlllCFaZZVg6JtM4vt1J1UdeqU4Broc7zLSnkyw9YUGXV0ybKbGz_IGBxWEry1lE-sHNE7e7bfHDhoxVN_wPhZ9rUDlRKFzDbyhX1HqF2gOsGl_0Cgw4IVTSaDMImnLQ8Cg_gcjI5mAfSbHq9QE2SYOta8yxb5eyZOgzXrgk9QDih-4a2eCJ1o=&xkcb=SoCe-_M3QXvhnsADTz0DbzkdCdPP&p=7&fvj=0&vjs=3,5dfe81bab0f97ace,PostedPosted 30+ days ago,2023-04-23T17:51:14.902Z,"Using financial principles to identify trends in data.
 A high school diploma or GED plus 7 years of relevant experience, or an Associate's degree plus 5 years…",www.indeed.com/applystart?jk=5dfe81bab0f97ace
Financial Analyst – Radiology (Hybrid/Remote),Financial Analyst ,$24.28 - $48.04 an hour,,,UCLA Health,"Remote in Los Angeles, CA 90095+3 locations",4.0,https://www.indeed.com/pagead/clk?mo=r&ad=-6NYlbfkN0DsE7ViekIsjp64t_8fXghHOV1s5s2e0k6cDP9wEyz_6tOierAtAOrZrCNnhU-ul8sj6-zaTxUi7c0VzUSm2tETlqdpLDoAhBj4CcUQxU5r3ThTADhW1iLMgdxOuWd8p03XbgKkc0AfenjfGwInekh8LU2ORt1cMMUxhS0hBe9oHqSQUeGrWQJtmxhXr89jL4HEzivHdPtk_2MOP6k3RLcY3VqidBa4MAW49thjvMfYnUTC6cRRr5t4Si89W9MLsMyXneInreU799SQXRuZEcv8w-dIzTgiMti7Ns3UW1ZkH1vB0fQhFfICwb6NGNfm0lzU38RjRMdR8f0DRRZHpBZYXNQchcIlO1xp0cKvfaJkFoehkVen0t8IGlXOz-uKPwkKWwANB899UL4xb0MHAfk-6VCxucZacMhXLTdwECVTOYl5fOhpZHiwnpox7r3d98MyF2BwH_9N-TbgoacTJOLFjdOyjsfIXxwZ3QaO7qA0iH3YyLpjFvTmHUy_mmLN7zm3iEfj9642GOUkzG4AKt12kIUSfKOMxaNLRhhmnJIbsT__prFqJvtWfWqlaS7gHuR55Xoa4sVcf7iZglmGrSnGR_SJW7uoX27St38BQEwtLehbhsxZ0JYVKNWkpCz-Oz6eNQo9UhmbPTHejX4bhV03FsdmXcXG0adH0ADsqV-4X0hJLBX51vf-OKAdZG7gjMZY3pUrf6w9uzY4NhtmN7F_InpTbXIbifM_Tcn-PRC392UmxpH0gTKmYMzKSEOSkJ0Aj81fup3vUNtO4B__cGJW0JISU3Szza4MeWgyH243QD5cVzd5jIoFk1I-4cecS_AJm9hc8CjqBg==&xkcb=SoAq-_M3QXvhnsADTz0CbzkdCdPP&p=8&fvj=0&vjs=3,d09485698d978e0c,PostedPosted 30+ days ago,2023-04-23T17:51:14.902Z," 
 Work closely with Research Director to prepare financial summaries of PI’s projects.
 Responsible for generating ad hoc reports as requested by faculty and staff…
",www.indeed.com/applystart?jk=d09485698d978e0c
FP&A Associate,Financial Analyst ,"$50,000 - $72,000 a year",Full-time,,Zoetis,Remote,3.6,https://www.indeed.com/rc/clk?jk=68c2aef0cb94e081&fccid=745f1dbed6d65d32&vjs=3,68c2aef0cb94e081,PostedPosted 5 days ago,2023-04-23T17:51:14.902Z," 
 The program provides broad exposure to multiple roles in Zoetis FP&A and intends to culminate with placement in a permanent role at the end of the rotational…
",www.indeed.com/applystart?jk=68c2aef0cb94e081
Financial Analyst - DIRECT HIRE (Remote Eligible) BIL,Financial Analyst ,"$78,592 - $172,075 a year",Full-time +2,,US Office of the Secretary of Transportation,"Remote in Washington, DC 20590",,https://www.indeed.com/rc/clk?jk=df493a888bc6bc73&fccid=ef125eca46f6a9b8&vjs=3,df493a888bc6bc73,PostedPosted 4 days ago,2023-04-23T17:51:14.903Z," 
 Review and evaluate financial systems for effectiveness of internal controls and integrity of the organization's financial information.
",www.indeed.com/applystart?jk=df493a888bc6bc73
Junior Financial Analyst,Financial Analyst ,,,,"PEOPLEASE, LLC",Remote,3.8,https://www.indeed.com/rc/clk?jk=34fe67c56ac728cc&fccid=56f1935a06c3b47d&vjs=3,34fe67c56ac728cc,PostedPosted 7 days ago,2023-04-23T17:51:14.903Z," 
 Strong strategic, technical, analytical and problem-solving skills.
 The purpose of the Accounting & Finance Department is to manage the planning and forecasting…
",www.indeed.com/applystart?jk=34fe67c56ac728cc
Financial Analyst (Remote),Financial Analyst ,,Weekend availability,,MarginEdge,"Remote in Arlington, VA",,https://www.indeed.com/company/MarginEdge/jobs/Financial-Analyst-77d027ce971c305c?fccid=0d740ab8ef50b1a0&vjs=3,77d027ce971c305c,EmployerActive 4 days ago,2023-04-23T17:51:14.903Z," 
 Strong analytical and financial modeling skills.
 Identify trends in financial performance and provide recommendations for improvement.
",www.indeed.com/applystart?jk=77d027ce971c305c
Financial Systems Analyst - Digital Finance (Remote),Financial Analyst ,"$170,000 a year",,,Home Depot / THD,"Remote in Atlanta, GA 30301",3.7,https://www.indeed.com/rc/clk?jk=ddb91badd685d24f&fccid=82e58e9861d48566&vjs=3,ddb91badd685d24f,PostedPosted 9 days ago,2023-04-23T17:51:14.903Z,"Ability to communicate and synthesize technical and business information to technical and non-technical individual stakeholders.
 1+ year of SAP experience.",www.indeed.com/applystart?jk=ddb91badd685d24f
Real Estate Development Financial Analyst,Financial Analyst ,"$60,000 - $80,000 a year",Full-time,Monday to Friday,StarPlex Real Estate Solutions,"Austin, TX 78750",,https://www.indeed.com/pagead/clk?mo=r&ad=-6NYlbfkN0BTT1lo8Jwdy_hu5PBsWOg-OgEs4ry3bvHurgSPaoaOHOLZU8cN4twXhwSE5u8UKr_DVk6AzycB0JUVHbhChEckbfO6V3Q8F_GCoW-Ttw6KsV8ewVFqf8FdiL56-Gn300u67F0YMzfkKvFFSNrMJ9HF7TCU9pwPidIFcpQrJwhxW84eMoMxYp_xmAn6MiQUqqdNNl99ndsWDAgTHziNYqcNVuA_Ty9Lx6vNJ2DjnvVeI16FhmBWG9_9N6DjpSBmgIqBi9CM_oAmWkyG6YhocHAKaVvgu2Z7IRFhiyVQ0GOQddQQzVkxPMf_CTHXrJ_Z6yyOA6hFbFuV756J8OzawB2RVnlWJlQ_Zerkv-9EDVnPGY5lsyEI1oWjrpJDOx-0ik_y9SgJpuMx3PhDeuRtXyhp-QfaBVjeETeM4gmPkbK3vdU8bMgK2JJpo4wM8ht-gSUgirk86_O7U-HD86AkpI_2-wk7l9KU9xi7XBBknQ-wNhxXOCnBzvNv4WkQSxbAK08QFuOeITcGHLnAd33oebOLPO4ENNQpda6VLdVhRZqjERxcegtHV1BS&xkcb=SoAQ-_M3QXvhnsADTz0EbzkdCdPP&p=14&fvj=1&vjs=3,fc6cc4b2b093402e,EmployerActive 2 days ago,2023-04-23T17:51:14.904Z," 
 The Financial Analyst will assist the Asset Management team by creating, maintaining and/or running financial pro forma models in the support of Acquisitions …
",www.indeed.com/applystart?jk=fc6cc4b2b093402e
Senior Financial Analyst,Financial Analyst ,,Monday to Friday,,Overhead Door Corporation,"Lewisville, TX+1 location",3.2,https://www.indeed.com/pagead/clk?mo=r&ad=-6NYlbfkN0BeTO_YHTovx6vODTo2YnWMUzoLmCd_EeTvSQD4Od5NZPk6IkaKFFmb568Wx6QG_6p_dK1dLlVA9YE0ez9x_YLAWaICLBSQ-sOjHwENIR62rcn3L7HuhhFqHa5-h73_F3IWeo4qR4are0is3WDOgnz79CTaMApGBAJEgohSBCWSNP1VuPR9IWeWgbULsQ6c3dQ04mqLE9dUXC_dW1hDZtPJPmsQLrXnMkiEuimd9uYsP_7my7Xd_jnRDLgXiHJVtdna1tBD_et5MV4z4_1jgnQ-OWm0HAbEavntY3dY7dxPRj412D8ILALMQvqkcui07An5zwcoR9EWiJFvXgeb_j5zlF-9iDOrDVljUE6fKcqmdYvLlQVncUCvr1xgEd44pWq06L-vktJ91Tysn2IVAhdI3No99YeF2LlHuah6-0jSp1F7ncUQ8YsgK304eePvg1X6p8doMAni_DXosOu1uniTyyBvcOE3eONSDWKeLd1025v2d-7Q9ki9pJ4cbyz6uPRPRPNL9yqQCTOVR5350AjJpK4TY958kLA=&xkcb=SoDA-_M3QXvgz1w8M50KbzkdCdPP&p=0&fvj=1&vjs=3,dd3e3147972c8b6f,EmployerActive 10 days ago,2023-04-23T17:51:21.656Z," 
 As the Senior Financial Analyst, you will report directly to the Director of Financial Planning and Analysis and be responsible for providing ongoing financial…
",www.indeed.com/applystart?jk=dd3e3147972c8b6f
Financial Analyst (Remote),Financial Analyst ,,Weekend availability,,MarginEdge,"Remote in Arlington, VA",,https://www.indeed.com/company/MarginEdge/jobs/Financial-Analyst-77d027ce971c305c?fccid=0d740ab8ef50b1a0&vjs=3,77d027ce971c305c,EmployerActive 4 days ago,2023-04-23T17:51:21.656Z," 
 Strong analytical and financial modeling skills.
 Identify trends in financial performance and provide recommendations for improvement.
",www.indeed.com/applystart?jk=77d027ce971c305c
Financial Systems Analyst - Digital Finance (Remote),Financial Analyst ,"$170,000 a year",,,Home Depot / THD,"Remote in Atlanta, GA 30301",3.7,https://www.indeed.com/rc/clk?jk=ddb91badd685d24f&fccid=82e58e9861d48566&vjs=3,ddb91badd685d24f,PostedPosted 9 days ago,2023-04-23T17:51:21.656Z,"Ability to communicate and synthesize technical and business information to technical and non-technical individual stakeholders.
 1+ year of SAP experience.",www.indeed.com/applystart?jk=ddb91badd685d24f
Financial Analyst - Remote,Financial Analyst ,"$54,800 - $87,707 a year",,,Paycor,Remote,3.1,https://www.indeed.com/rc/clk?jk=6593cb84f8997403&fccid=f490aa2d3c80bc75&vjs=3,6593cb84f8997403,PostedPosted 11 days ago,2023-04-23T17:51:21.656Z,"Support creation of financial models for new and existing products.
 401(k) with $.65 match for every dollar contributed up to 6% of eligible pay.",www.indeed.com/applystart?jk=6593cb84f8997403
"Jr, Financial Analyst",Financial Analyst ,,,,"Hepburn and Sons, LLC","Remote in Washington, DC 20003",4.5,https://www.indeed.com/rc/clk?jk=ef7fc527c9e63ab8&fccid=ff84280cf05390bd&vjs=3,ef7fc527c9e63ab8,PostedPosted 30+ days ago,2023-04-23T17:51:21.656Z,"3 years DoD/Navy financial management.
 Participate in reviews and maintain knowledge of technical and programmatic elements that impact program budget exhibits.",www.indeed.com/applystart?jk=ef7fc527c9e63ab8
Financial Analyst (Remote-Home Based Worker),Financial Analyst ,"$52,500 - $70,000 a year",,,Allstate,"Remote in Chicago, IL+2 locations",3.7,https://www.indeed.com/rc/clk?jk=e4dcd6df4eac9c3e&fccid=3a71a4d2f7990a25&vjs=3,e4dcd6df4eac9c3e,PostedPosted 30+ days ago,2023-04-23T17:51:21.657Z," 
 Intermediate business knowledge (i.e. deep financial skills/flow of the numbers) of financial and accounting concepts as well as intermediate analytical and…
",www.indeed.com/applystart?jk=e4dcd6df4eac9c3e
Financial Planning & Analysis Analyst,Financial Analyst ,,,,EAB,"Washington, DC 20036 (Downtown area)+1 location",3.7,https://www.indeed.com/rc/clk?jk=590baec9edce4a91&fccid=a168335bbdcce5e0&vjs=3,590baec9edce4a91,PostedPosted 9 days ago,2023-04-23T17:51:21.657Z," 
 Experience developing financial or Excel models.
 Creating and maintaining firm wide revenue forecast models, including predictive analytics models.
",www.indeed.com/applystart?jk=590baec9edce4a91
Financial Analyst,Financial Analyst ,"$140,000 - $160,000 a year",Full-time,,Anthropic,"Hybrid remote in San Francisco, CA 94111",,https://www.indeed.com/rc/clk?jk=d2fd6ef3b57f7a60&fccid=8f0d04a86e31340d&vjs=3,d2fd6ef3b57f7a60,PostedPosted 9 days ago,2023-04-23T17:51:21.657Z," 
 Develop and own financial models to support strategic initiatives.
 Experience working with large data-sets and building complex financial models.
",www.indeed.com/applystart?jk=d2fd6ef3b57f7a60
Senior Accountant/Financial Analyst,Financial Analyst ,"$75,000 - $100,000 a year",Full-time,Monday to Friday +1,Sikich LLP,+1 locationRemote,3.8,https://www.indeed.com/pagead/clk?mo=r&ad=-6NYlbfkN0DtUzYUlKgCUbmjLqD8yN-5XyQJWZq4P9QHIL2T-QvOZD5HLJTa07mDZQpUdt0m6msbFgLdzFXPALlxDhS0IwR_F1G4G5GAIgCRPj73BsHRl0yPOHqFnKg197-pROVM1GjTCzcfOiAT9qitmYIcJuxzpvOZocweQKiHqI7DIUBErutvnCIXcRxkLokSIOtz5HtbHgpBEXXtQ0YitQ2MwvOuPBk-EJaBS9s-XrgYZwseLmCfvXLPLBxS_ogEn5ve-dhkh1EefDmbcyinF-PlJwE2q6mQn_68xg0gJ2S_wZHbNEvNeD3Jk0vokRjAJUK4I_fGDaKGiHRjpVfLzXLSmx7g2CDZtRrd42D8rdjSe23KZ2PbKWxUMa_0c6mHnied4u2-L996_RAsxXA0IBvU79XVIJy60z19cMk5iQvkPdXSNaUZRvmfmuqk3MV2lB4yiSrVb0ddb78X6wdEP3bnL6sgrluso9tWGLJEMbjvIBVc0O5aWR6hYWW0vj-uoWs8Z967KpThHZYE-Si_vPCMxmx-G-lG3ey-M4s=&xkcb=SoA6-_M3QXvgz1w8M50BbzkdCdPP&p=8&fvj=1&vjs=3,57d31f286c1cad42,PostedPosted 2 days ago,2023-04-23T17:51:21.657Z," 
 Proven track record of improving financial and operational processes, preferably with growth companies.
 Analyzing, developing, and working with client teams to…
",www.indeed.com/applystart?jk=57d31f286c1cad42
Financial Planning Analyst,Financial Analyst ,"$90,000 - $120,000 a year",,,Cisive,Remote,2.0,https://www.indeed.com/rc/clk?jk=44bfd4ab1777c774&fccid=ceb736c32d3c5070&vjs=3,44bfd4ab1777c774,PostedPosted 10 days ago,2023-04-23T17:51:21.658Z," 
 Advanced financial modeling skills strongly preferred.
 Prepare quarterly board presentations and monthly financial dashboards for both internal and external…
",www.indeed.com/applystart?jk=44bfd4ab1777c774
"Analyst, Financial",Financial Analyst ,"$45,000 - $60,000 a year",Full-time,,Warner Music Group,+1 locationRemote,4.1,https://www.indeed.com/rc/clk?jk=0d165ff994c36ba7&fccid=5c9de1aedf73e3b6&vjs=3,0d165ff994c36ba7,PostedPosted 30+ days ago,2023-04-23T17:51:21.658Z," 
 Prepare participation, Pressing & Distribution (P&D), merchandise, and tour statements in accordance with financial terms detailed in the contract.
",www.indeed.com/applystart?jk=0d165ff994c36ba7
Financial Analyst,Financial Analyst ,"From $65,000 a year",Full-time,Monday to Friday,Tiger Capital Group,+2 locationsRemote,,https://www.indeed.com/company/Tiger-Group/jobs/Financial-Analyst-eb4b51360890fd03?fccid=25ce223ea265db92&vjs=3,eb4b51360890fd03,EmployerActive 2 days ago,2023-04-23T17:51:21.658Z," 
 Experience with financial analysis (internships).
 The financial analyst is responsible for all quantitative analysis in the appraisal report, working with…
",www.indeed.com/applystart?jk=eb4b51360890fd03
DATA SUPPORT ANALYST III - FISCAL,Financial Analyst ,"$70,406 - $101,449 a year",Full-time,8 hour shift,Milwaukee Public Schools,"Milwaukee, WI 53208 (Wick Field area)+1 location",3.7,https://www.indeed.com/pagead/clk?mo=r&ad=-6NYlbfkN0B-1gesSuP4SarRAYtgz5HkGKPGzFkAyh1NkcdlIWkJ0IQ6xtEMWVdlshU776-BTBhczijDZGpnzegrkWRGjSpT5zVthiQqVFm11D-KC3189RWzJfN0oQ1tGldQuAvZPnIa1FtqUzuUKHM1z4ZUxSRmCWS_X8SGynaAWtk-rTdS0FUj2SQp5-rALwzAQqH4t_Vf3HmH1wyAA0wSN0vcC1fKY-zuvgqz01CPYRFBUJO1qCp1kAPpuy8LFNaMRDP1PUWbuIy3tDEQJIEdMPj0zzBjlu_FA4Ek0ZmUIojTUNldA-3m_ObwmCpplg16vLajchg0szqCT_K-43U4hANZNHK05I8fJw12tiixVAOnhip52uvH_AghgCSJw6yiknCQQSb1wH3J4fqeGsLyx6dK1jQ0pUXHTUo1Q8L59VYIbv7yASbKYAFZ1Qvcb0ckR8_rdr6hd6KZQjs04w7heRZBxWMaJLn6I_aaq09QG8-1c-CTg2TFsFeEJPNGgjoLr8jwSvtV_Nv4jU1Wwy_b4IKJY52Jbp68xa6TrL_fn-mzvwOgpCg3Ph17tdIv&xkcb=SoAp-_M3QXvgz1w8M50FbzkdCdPP&p=12&fvj=1&vjs=3,0ef5f6fdb99087bf,PostedPosted 2 days ago,2023-04-23T17:51:21.658Z," 
 This position utilizes specialized knowledge of software & systems components and applies knowledge and skills in problem-solving and implementing configuration…
",www.indeed.com/applystart?jk=0ef5f6fdb99087bf
Program Financial Analyst,Financial Analyst ,"$100,000 a year",Full-time,,The Aerospace Corporation,Remote,4.0,https://www.indeed.com/rc/clk?jk=efed2af665bd83d4&fccid=ba923b146fa75d0d&vjs=3,efed2af665bd83d4,PostedPosted 30+ days ago,2023-04-23T17:51:21.658Z," 
 Generates various reports including weekly/monthly financial analysis, year-end financial reporting, and ad-hoc reports.
 Paid holidays, sick time, and vacation.
",www.indeed.com/applystart?jk=efed2af665bd83d4
Senior Financial Analyst,Financial Analyst ,"$110,000 - $128,500 a year",Full-time,Monday to Friday,Goetzman Group,"Hybrid remote in Los Angeles, CA",4.5,https://www.indeed.com/pagead/clk?mo=r&ad=-6NYlbfkN0DIFdrbrjXiIvhxitN5jRRzLEq-kaYjMkBxmS5W7xeZiTqY7GURP2fpMeFXUdOZ3zzApHHVcn8ItHPeCmvb4BTwrN-GAU7zJsr7DWaUy2X2kma7O4dUWTQDaWK9p-8jv6n7wey8giJyriIuN7muEiWJfxB9_2hFzVpWOqCzRbeuJ3JNA_oZ9wXjCVPZMC8JJGBn83o4ifkOWjqCD0DT73Nezs8rhcOdUXyhfC4J5s5dDQwPBIgDk6ngSjzM54Jf2pgD7Xf4DjQspoFp7hWzyU6RJqKoOpQWV13fQl6-RPETJLhklNSAPS8bmVPvMdDvAjFFUTwR9aFpp-jjhGp_3U91GVe8_u97Tkllz00WNCQA5G5iAINliE7W3FfaCYdRCpVfRdmtOUngbNqQzfnRQ0HPM0HUwCzKFHzT_euZSvuMVg8dUryfm-FLfYxjrQ3btP2m3brc92nzHMomQtzr8M3QOjOKx9poHJ17EUAy4nhfEJR5FC1i4tZsPbLxi0VxqbHmcaarQ9lPw7gnaBwq4XS9&xkcb=SoC6-_M3QXvgz1w8M50bbzkdCdPP&p=14&fvj=1&vjs=3,1b2a9ae2c1a963d7,EmployerActive 3 days ago,2023-04-23T17:51:21.659Z,"Minimum 6-8 plus years of progressive experience in Accounting and/or Finance.
 Accounting and/or Finance: 6 years (Preferred).",www.indeed.com/applystart?jk=1b2a9ae2c1a963d7